{
  "asset_id": "asset_last_observatory_key_panel_v1",
  "project_id": "project_demo",
  "asset_type": "key_panel",
  "content_hash": "e2c72c57e72d048781a2fb626b503183017ef35ed0ee118bc9b9ffbc9813d4ef",
  "storage_ref": "public/art/last-observatory-key-panel.png",
  "mime_type": "image/png",
  "width": 941,
  "height": 1672
}
